{
  "$schema": "https://json-schema.org/draft/2020-12/schema",
  "$id": "https://storyweaver.local/schemas/scene.schema.json",
  "title": "StoryWeaver Scene",
  "type": "object",
  "required": ["id", "name", "description"],
  "properties": {
    "id": { "type": "string", "pattern": "^scene_[0-9]{3,}$" },
    "name": { "type": "string", "minLength": 1 },
    "type": { "type": "string" },
    "description": { "type": "string" },
    "location": { "type": "string" },
    "function_in_story": { "type": "string" },
    "dynamic_state": { "type": "object" },
    "constraints": { "type": "array", "items": { "type": "string" } }
  },
  "additionalProperties": true
}
